{
  "artifact_kind": "pooleos_hardware_target_readiness",
  "binding_errors": [],
  "bindings": {
    "collector": {
      "byte_count": 22049,
      "path": "tools/collect_tier1_hardware.ps1",
      "sha256": "5A0F9C538FBE6FC8BC4BBB49114F3434208B3AE32F7034FE09AC5FA868314241"
    },
    "runtime": {
      "byte_count": 42835,
      "path": "runtime/hardware_target.py",
      "sha256": "AAA27935B1D94C7E93AAF2AAFA299B0C18664A9C189F59A89CF6C64866F6FFB3"
    },
    "sanitized_observation": {
      "byte_count": 16620,
      "path": "runs/tier1_hardware_observation.json",
      "sha256": "31AAFB5A2083CDA060F02EC079172A8734EC0CC8E55572935C8C7302EDD62B9C"
    },
    "standards_register": {
      "byte_count": 13553,
      "path": "specs/native-standards-register.json",
      "sha256": "FD9C5027728E668C6FC8B5C096080664B191ABA104FECCCACF74DD95385F07FD"
    },
    "support_policy": {
      "byte_count": 8315,
      "path": "specs/hardware-support-policy.json",
      "sha256": "E9B3DD912305C065E388D588DD3F51CF67E9AA092DBFC10E73F62AF84EA38F0E"
    },
    "tier1_target": {
      "byte_count": 9005,
      "path": "specs/tier1-hardware-target.json",
      "sha256": "E6976539E72D32974918B2ABA7AB53043AB44AB478D8CBA0ABF9E30E66869F89"
    }
  },
  "claim_boundary": [
    "This ledger proves that a sanitized Windows-host observation consistently matches the declared Tier-1 identity checks; it is not PooleBoot or PooleKernel hardware enumeration evidence.",
    "16 bounded user-mode CPUID records on the current host are partial CPU evidence; MSR and native CPUID comparison remain open.",
    "A matching model, firmware, or hardware-ID prefix does not qualify a native driver, DMA confinement, reset, power, recovery, update, or daily-driver claim.",
    "Private capture bytes remain local and are represented publicly only by SHA-256 and byte count.",
    "Unresolved standards, evidence channels, and destructive-test prerequisites keep N2 open and production promotion prohibited.",
    "No firmware, TPM, disk, boot, power, device, or configuration mutation was authorized or performed."
  ],
  "evidence_coverage": {
    "channels": [
      {
        "detail": "allowlisted board, firmware, CPU, memory, storage, display, and network properties",
        "id": "CIM_CORE_INVENTORY",
        "status": "observed"
      },
      {
        "detail": "bus and hardware identifiers only; instance suffixes removed",
        "id": "PNP_HARDWARE_PREFIXES",
        "status": "observed"
      },
      {
        "detail": "UEFI",
        "id": "UEFI_FIRMWARE_TYPE",
        "status": "observed"
      },
      {
        "detail": "table signatures, byte counts, and SHA-256 only",
        "id": "ACPI_TABLE_HASHES",
        "status": "observed"
      },
      {
        "detail": "raw table bytes are not published",
        "id": "SMBIOS_RAW_HASH",
        "status": "observed"
      },
      {
        "detail": "derived only from ACPI IVRS presence",
        "id": "AMD_IOMMU_IVRS",
        "status": "observed"
      },
      {
        "detail": "read-only Confirm-SecureBootUEFI query",
        "id": "SECURE_BOOT_STATE",
        "status": "permission_limited"
      },
      {
        "detail": "no EK, certificate, owner state, or key material requested",
        "id": "TPM_INVENTORY",
        "status": "permission_limited"
      },
      {
        "detail": "serial field excluded; full EDID acquisition remains separate",
        "id": "EDID_IDENTITY",
        "status": "observed"
      },
      {
        "detail": "direct user-mode CPUID records=16; MSR remains pending a reviewed privileged mechanism",
        "id": "CPU_CPUID_MSR",
        "status": "partial"
      },
      {
        "detail": "PnP identifiers do not replace ECAM/configuration-space capture",
        "id": "PCI_CONFIG_SPACE",
        "status": "pending_tool"
      },
      {
        "detail": "CIM part/capacity/channel facts only; raw SPD not acquired",
        "id": "SPD_MEMORY_TOPOLOGY",
        "status": "partial"
      },
      {
        "detail": "no firmware writes, fan changes, stress load, or power action performed",
        "id": "SENSORS_AND_POWER",
        "status": "unavailable"
      },
      {
        "detail": "no NVRAM variable values acquired in this cycle",
        "id": "UEFI_VARIABLE_SNAPSHOT",
        "status": "pending_tool"
      }
    ],
    "cpu_architecture_components": {
      "combined_channel_complete": false,
      "cpuid_affinity_policy": "lowest_process_allowed_logical_processor_restored_per_query",
      "cpuid_record_count": 16,
      "cpuid_status": "observed",
      "cpuid_transcript_sha256": "1C4EB05B165ABA43F3DED644B0ADFB29A96D8919D0A15948028C1BEA03CC2848",
      "msr_status": "pending_reviewed_privileged_mechanism"
    },
    "observed_required_channel_count": 7,
    "partial_required_channel_count": 2,
    "pending_required_channel_ids": [
      "CPU_CPUID_MSR",
      "PCI_CONFIG_SPACE",
      "SECURE_BOOT_STATE",
      "SENSORS_AND_POWER",
      "SPD_MEMORY_TOPOLOGY",
      "TPM_INVENTORY",
      "UEFI_VARIABLE_SNAPSHOT"
    ],
    "required_channel_count": 14
  },
  "lab_safety": {
    "accepted_prerequisite_count": 0,
    "destructive_testing_approved": false,
    "mutation_performed": false,
    "pending_prerequisite_ids": [
      "LAB-SAFE-SSD-001",
      "LAB-SAFE-USB-A-001",
      "LAB-SAFE-USB-B-001",
      "LAB-SAFE-BACKUP-001",
      "LAB-SAFE-RECOVERY-001",
      "LAB-SAFE-SECOND-HOST-001",
      "LAB-SAFE-SERIAL-001",
      "LAB-SAFE-POWER-001",
      "LAB-SAFE-NETWORK-001",
      "LAB-SAFE-APPROVAL-001"
    ],
    "prerequisite_count": 10
  },
  "n2_exit_gate_satisfied": false,
  "negative_controls": [
    {
      "expected": "reject",
      "id": "reject_serial_field",
      "observed": "reject",
      "status": "pass"
    },
    {
      "expected": "reject",
      "id": "reject_mac_address",
      "observed": "reject",
      "status": "pass"
    },
    {
      "expected": "reject",
      "id": "reject_absolute_user_path",
      "observed": "reject",
      "status": "pass"
    },
    {
      "expected": "reject",
      "id": "reject_full_pnp_instance",
      "observed": "reject",
      "status": "pass"
    },
    {
      "expected": "reject",
      "id": "reject_substituted_baseboard",
      "observed": "reject",
      "status": "pass"
    },
    {
      "expected": "reject",
      "id": "reject_missing_required_fact",
      "observed": "reject",
      "status": "pass"
    },
    {
      "expected": "reject",
      "id": "reject_target_identity_substitution",
      "observed": "reject",
      "status": "pass"
    },
    {
      "expected": "reject",
      "id": "deny_destructive_testing_without_acceptance",
      "observed": "reject",
      "status": "pass"
    },
    {
      "expected": "reject",
      "id": "deny_unlisted_hardware_promotion",
      "observed": "reject",
      "status": "pass"
    },
    {
      "expected": "reject",
      "id": "deny_private_capture_publication",
      "observed": "reject",
      "status": "pass"
    },
    {
      "expected": "reject",
      "id": "reject_cpuid_processor_serial_leaf",
      "observed": "reject",
      "status": "pass"
    },
    {
      "expected": "reject",
      "id": "reject_malformed_cpuid_transcript_hash",
      "observed": "reject",
      "status": "pass"
    },
    {
      "expected": "reject",
      "id": "reject_msr_completion_without_evidence",
      "observed": "reject",
      "status": "pass"
    },
    {
      "expected": "reject",
      "id": "reject_privileged_driver_overclaim",
      "observed": "reject",
      "status": "pass"
    }
  ],
  "open_items": [
    "Reconcile the vendor BIOS release date with the CIM UTC date representation.",
    "Complete the CPU channel with reviewed MSR evidence; direct bounded user-mode CPUID is captured but remains non-promoting.",
    "Acquire PCI configuration-space, EDID, SPD, ACPI duplicate-table, UEFI-variable, sensor, and power evidence with reviewed read-only tools.",
    "Resolve TPM inventory permission without requesting EK, certificate, owner, or secret material.",
    "Acquire and hash every lawfully accessible locked standard and complete supersession/errata review.",
    "Owner must separately identify sacrificial media, backups, immutable recovery, a second recovery machine, serial path, power-cut apparatus, and explicit destructive-test approval.",
    "Define and qualify the Tier-0 QEMU/OVMF target under N4 before N2 can close."
  ],
  "privacy_validation": {
    "mode": "fixed_whitelist_reconstruction_plus_recursive_scan",
    "private_capture_content_present": false,
    "violation_count": 0,
    "violations": []
  },
  "production_promotion_allowed": false,
  "production_ready": false,
  "schema_validation": {
    "failure_count": 0,
    "results": {
      "observation": [],
      "policy": [],
      "standards_register": [],
      "target": []
    }
  },
  "schema_version": "1.1",
  "selected_move_id": "N2-HW-002",
  "standards_coverage": {
    "artifact_hash_verified_count": 0,
    "entry_count": 15,
    "metadata_locked_count": 10,
    "supersession_review_ids": [
      "STD-PCIE-BASE",
      "STD-NVME-BASE",
      "STD-TPM2-V185",
      "STD-IETF-NETWORK-PROFILE",
      "STD-EDID-CTA"
    ],
    "unresolved_entry_ids": [
      "STD-UEFI-2.11",
      "STD-ACPI-6.6",
      "STD-SMBIOS-3.9.0",
      "STD-AMD64-APM-4.09",
      "STD-AMD-IOMMU-3.09",
      "STD-PCIE-BASE",
      "STD-NVME-BASE",
      "STD-XHCI-1.2",
      "STD-USB-HID",
      "STD-TPM2-V185",
      "STD-VIRTIO-1.3-CSD01",
      "STD-UNICODE-17.0.0",
      "STD-POSIX-ISSUE8",
      "STD-IETF-NETWORK-PROFILE",
      "STD-EDID-CTA"
    ]
  },
  "status": "consistent_partial_non_promoting",
  "status_date": "2026-07-16",
  "summary": {
    "consistency_pass": true,
    "cpuid_record_count": 16,
    "matched_required_target_check_count": 24,
    "negative_control_count": 14,
    "negative_control_pass_count": 14,